question_code,question_title,choice1,choice2,choice3,choice4,correct,state,correct_rate,picture,year,round,subject
QS20183072,"소프트웨어 비용 산정 기법 중 개발 유형으로 organic, semi-detach, embedded로 구분되는 것은?",PUTNAM,COCOMO,FP,SLIM,2,정상,0,,2018,3,S
QS20183073,"소프트웨어 구조와 관련된 용어로, 주어진 한 모듈(Module)을 제어하는 상위 모듈 수를 나타내는 것은?",Modularity,Subordinate,Fan-in,Superordinate,3,정상,0,,2018,3,S
QS20183074,CASE(Computer Aided Software Engineering)에 대한 설명으로 가장 옳지 않은 것은?,프로그램의 구현과 유지보수 작업만을 중심으로 소프트웨어 생산성 문제를 해결한다.,소프트웨어 생명주기의 전체 단계를 연결해 주고 자동화해 주는 통합된 도구를 제공한다.,개발 과정의 속도를 향상시킨다.,소프트웨어 부품의 재사용을 가능하게 한다.,1,정상,0,,2018,3,S
QS20183075,소프트웨어 개발 중 가장 많은 비용이 요구되는 단계는?,분석,설계,구현,유지보수,4,정상,0,,2018,3,S
QS20183076,소프트웨어 품질 측정을 위해 개발자 관점에서 고려해야 할 항목으로 가장 거리가 먼 것은?,정확성,무결성,간결성,사용성,3,정상,0,,2018,3,S
QS20183077,정보 시스템 개발 단계에서 프로그래밍 언어 선택 시 고려할 사항으로 가장 거리가 먼 것은?,개발 정보 시스템의 특성,사용자의 요구사항,컴파일러의 가용성,컴파일러의 독창성,4,정상,0,,2018,3,S
QS20183078,Alien Code에 대한 설명으로 가장 옳은 것은?,프로그램의 로직이 복잡하여 이해하기 어려운 프로그램을 의미한다.,아주 오래되거나 참고 문서 또는 개발자가 없어 유지보수 작업이 어려운 프로그램을 의미한다.,오류(Error)가 없어 디버깅 과정이 필요 없는 프로그램을 의미한다.,차세대 언어를 사용해 인공지능적인 API를 제공함으로써 사용자가 직접 작성한 프로그램을 의미한다.,2,정상,0,,2018,3,S
QS20183079,소프트웨어 프로젝트 관리를 효율적으로 수행하기 위한 3P중 소프트웨어 프로젝트를 수행하기 위한 Task Framework의 고려와 가장 연관되는 것은?,People,Problem,Product,Process,4,정상,0,,2018,3,S
QS20183080,다음 중 공학적으로 잘 작성된 소프트웨어가 갖는 특성으로 가장 적합한 것은?,원하는 요구사항 중에 중요한 사항만 반영한다.,유지보수 비용이 많이 들어간다.,신뢰성이 떨어지더라도 효율성이 높다.,사용자가 손쉽게 사용할 수 있다.,4,정상,0,,2018,3,S
